{
 "mcu_family": "STM32F4",
 "variant": "STM32F42xxx",
 "reference_manual": "rm0090.pdf",
 "rm_revision": "RM0090 Rev 19",
 "peripheral": "I2C",
 "sections": {
  "clock": [
   161,
   212
  ],
  "gpio": [
   281,
   288
  ],
  "peripheral": [
   860,
   872
  ]
 },
 "clock_enables": [
  {
   "peripheral": "OTGHSULPI",
   "bus": "AHB1",
   "register": "RCC_AHB1ENR",
   "bit": 30,
   "confidence": "high",
   "source_pages": [
    180,
    181,
    182,
    210,
    211,
    212
   ]
  },
  {
   "peripheral": "OTGHS",
   "bus": "AHB1",
   "register": "RCC_AHB1ENR",
   "bit": 29,
   "confidence": "high",
   "source_pages": [
    180,
    181,
    182,
    210,
    211,
    212
   ]
  },
  {
   "peripheral": "ETHMACPTP",
   "bus": "AHB1",
   "register": "RCC_AHB1ENR",
   "bit": 28,
   "confidence": "high",
   "source_pages": [
    180,
    181,
    182,
    210,
    211,
    212
   ]
  },
  {
   "peripheral": "ETHMACRX",
   "bus": "AHB1",
   "register": "RCC_AHB1ENR",
   "bit": 27,
   "confidence": "high",
   "source_pages": [
    180,
    181,
    182,
    210,
    211,
    212
   ]
  },
  {
   "peripheral": "ETHMACTX",
   "bus": "AHB1",
   "register": "RCC_AHB1ENR",
   "bit": 26,
   "confidence": "high",
   "source_pages": [
    180,
    181,
    182,
    210,
    211,
    212
   ]
  },
  {
   "peripheral": "ETHMAC",
   "bus": "AHB1",
   "register": "RCC_AHB1ENR",
   "bit": 25,
   "confidence": "high",
   "source_pages": [
    180,
    181,
    182,
    210,
    211,
    212
   ]
  },
  {
   "peripheral": "DMA2D",
   "bus": "AHB1",
   "register": "RCC_AHB1ENR",
   "bit": 23,
   "confidence": "high",
   "source_pages": [
    180,
    181,
    182,
    210,
    211,
    212
   ]
  },
  {
   "peripheral": "DMA2",
   "bus": "AHB1",
   "register": "RCC_AHB1ENR",
   "bit": 22,
   "confidence": "high",
   "source_pages": [
    180,
    181,
    182,
    210,
    211,
    212
   ]
  },
  {
   "peripheral": "DMA1",
   "bus": "AHB1",
   "register": "RCC_AHB1ENR",
   "bit": 21,
   "confidence": "high",
   "source_pages": [
    180,
    181,
    182,
    210,
    211,
    212
   ]
  },
  {
   "peripheral": "CCMDATARAM",
   "bus": "AHB1",
   "register": "RCC_AHB1ENR",
   "bit": 20,
   "confidence": "high",
   "source_pages": [
    180,
    181,
    182,
    210,
    211,
    212
   ]
  },
  {
   "peripheral": "BKPSRAM",
   "bus": "AHB1",
   "register": "RCC_AHB1ENR",
   "bit": 18,
   "confidence": "high",
   "source_pages": [
    180,
    181,
    182,
    210,
    211,
    212
   ]
  },
  {
   "peripheral": "CRC",
   "bus": "AHB1",
   "register": "RCC_AHB1ENR",
   "bit": 12,
   "confidence": "high",
   "source_pages": [
    180,
    181,
    182,
    210,
    211,
    212
   ]
  },
  {
   "peripheral": "GPIOK",
   "bus": "AHB1",
   "register": "RCC_AHB1ENR",
   "bit": 10,
   "confidence": "high",
   "source_pages": [
    180,
    181,
    182,
    210,
    211,
    212
   ]
  },
  {
   "peripheral": "GPIOJ",
   "bus": "AHB1",
   "register": "RCC_AHB1ENR",
   "bit": 9,
   "confidence": "high",
   "source_pages": [
    180,
    181,
    182,
    210,
    211,
    212
   ]
  },
  {
   "peripheral": "GPIOI",
   "bus": "AHB1",
   "register": "RCC_AHB1ENR",
   "bit": 8,
   "confidence": "high",
   "source_pages": [
    180,
    181,
    182,
    210,
    211,
    212
   ]
  },
  {
   "peripheral": "GPIOH",
   "bus": "AHB1",
   "register": "RCC_AHB1ENR",
   "bit": 7,
   "confidence": "high",
   "source_pages": [
    180,
    181,
    182,
    210,
    211,
    212
   ]
  },
  {
   "peripheral": "GPIOG",
   "bus": "AHB1",
   "register": "RCC_AHB1ENR",
   "bit": 6,
   "confidence": "high",
   "source_pages": [
    180,
    181,
    182,
    210,
    211,
    212
   ]
  },
  {
   "peripheral": "GPIOF",
   "bus": "AHB1",
   "register": "RCC_AHB1ENR",
   "bit": 5,
   "confidence": "high",
   "source_pages": [
    180,
    181,
    182,
    210,
    211,
    212
   ]
  },
  {
   "peripheral": "GPIOE",
   "bus": "AHB1",
   "register": "RCC_AHB1ENR",
   "bit": 4,
   "confidence": "high",
   "source_pages": [
    180,
    181,
    182,
    210,
    211,
    212
   ]
  },
  {
   "peripheral": "GPIOD",
   "bus": "AHB1",
   "register": "RCC_AHB1ENR",
   "bit": 3,
   "confidence": "high",
   "source_pages": [
    180,
    181,
    182,
    210,
    211,
    212
   ]
  },
  {
   "peripheral": "GPIOC",
   "bus": "AHB1",
   "register": "RCC_AHB1ENR",
   "bit": 2,
   "confidence": "high",
   "source_pages": [
    180,
    181,
    182,
    210,
    211,
    212
   ]
  },
  {
   "peripheral": "GPIOB",
   "bus": "AHB1",
   "register": "RCC_AHB1ENR",
   "bit": 1,
   "confidence": "high",
   "source_pages": [
    180,
    181,
    182,
    210,
    211,
    212
   ]
  },
  {
   "peripheral": "GPIOA",
   "bus": "AHB1",
   "register": "RCC_AHB1ENR",
   "bit": 0,
   "confidence": "high",
   "source_pages": [
    180,
    181,
    182,
    210,
    211,
    212
   ]
  },
  {
   "peripheral": "OTGFS",
   "bus": "AHB2",
   "register": "RCC_AHB2ENR",
   "bit": 7,
   "confidence": "high",
   "source_pages": [
    182,
    183,
    210,
    211,
    212
   ]
  },
  {
   "peripheral": "RNG",
   "bus": "AHB2",
   "register": "RCC_AHB2ENR",
   "bit": 6,
   "confidence": "high",
   "source_pages": [
    182,
    183,
    210,
    211,
    212
   ]
  },
  {
   "peripheral": "HASH",
   "bus": "AHB2",
   "register": "RCC_AHB2ENR",
   "bit": 5,
   "confidence": "high",
   "source_pages": [
    182,
    183,
    210,
    211,
    212
   ]
  },
  {
   "peripheral": "CRYP",
   "bus": "AHB2",
   "register": "RCC_AHB2ENR",
   "bit": 4,
   "confidence": "high",
   "source_pages": [
    182,
    183,
    210,
    211,
    212
   ]
  },
  {
   "peripheral": "DCMI",
   "bus": "AHB2",
   "register": "RCC_AHB2ENR",
   "bit": 0,
   "confidence": "high",
   "source_pages": [
    182,
    183,
    210,
    211,
    212
   ]
  },
  {
   "peripheral": "FMC",
   "bus": "AHB3",
   "register": "RCC_AHB3ENR",
   "bit": 0,
   "confidence": "high",
   "source_pages": [
    183,
    210,
    211,
    212
   ]
  },
  {
   "peripheral": "UART8",
   "bus": "APB1",
   "register": "RCC_APB1ENR",
   "bit": 31,
   "confidence": "high",
   "source_pages": [
    183,
    184,
    185,
    186,
    187,
    210,
    211,
    212
   ]
  },
  {
   "peripheral": "UART7",
   "bus": "APB1",
   "register": "RCC_APB1ENR",
   "bit": 30,
   "confidence": "high",
   "source_pages": [
    183,
    184,
    185,
    186,
    187,
    210,
    211,
    212
   ]
  },
  {
   "peripheral": "DAC",
   "bus": "APB1",
   "register": "RCC_APB1ENR",
   "bit": 29,
   "confidence": "high",
   "source_pages": [
    183,
    184,
    185,
    186,
    187,
    210,
    211,
    212
   ]
  },
  {
   "peripheral": "PWR",
   "bus": "APB1",
   "register": "RCC_APB1ENR",
   "bit": 28,
   "confidence": "high",
   "source_pages": [
    183,
    184,
    185,
    186,
    187,
    210,
    211,
    212
   ]
  },
  {
   "peripheral": "CAN2",
   "bus": "APB1",
   "register": "RCC_APB1ENR",
   "bit": 26,
   "confidence": "high",
   "source_pages": [
    183,
    184,
    185,
    186,
    187,
    210,
    211,
    212
   ]
  },
  {
   "peripheral": "CAN1",
   "bus": "APB1",
   "register": "RCC_APB1ENR",
   "bit": 25,
   "confidence": "high",
   "source_pages": [
    183,
    184,
    185,
    186,
    187,
    210,
    211,
    212
   ]
  },
  {
   "peripheral": "I2C3",
   "bus": "APB1",
   "register": "RCC_APB1ENR",
   "bit": 23,
   "confidence": "high",
   "source_pages": [
    183,
    184,
    185,
    186,
    187,
    210,
    211,
    212
   ]
  },
  {
   "peripheral": "I2C2",
   "bus": "APB1",
   "register": "RCC_APB1ENR",
   "bit": 22,
   "confidence": "high",
   "source_pages": [
    183,
    184,
    185,
    186,
    187,
    210,
    211,
    212
   ]
  },
  {
   "peripheral": "I2C1",
   "bus": "APB1",
   "register": "RCC_APB1ENR",
   "bit": 21,
   "confidence": "high",
   "source_pages": [
    183,
    184,
    185,
    186,
    187,
    210,
    211,
    212
   ]
  },
  {
   "peripheral": "UART5",
   "bus": "APB1",
   "register": "RCC_APB1ENR",
   "bit": 20,
   "confidence": "high",
   "source_pages": [
    183,
    184,
    185,
    186,
    187,
    210,
    211,
    212
   ]
  },
  {
   "peripheral": "UART4",
   "bus": "APB1",
   "register": "RCC_APB1ENR",
   "bit": 19,
   "confidence": "high",
   "source_pages": [
    183,
    184,
    185,
    186,
    187,
    210,
    211,
    212
   ]
  },
  {
   "peripheral": "USART3",
   "bus": "APB1",
   "register": "RCC_APB1ENR",
   "bit": 18,
   "confidence": "high",
   "source_pages": [
    183,
    184,
    185,
    186,
    187,
    210,
    211,
    212
   ]
  },
  {
   "peripheral": "USART2",
   "bus": "APB1",
   "register": "RCC_APB1ENR",
   "bit": 17,
   "confidence": "high",
   "source_pages": [
    183,
    184,
    185,
    186,
    187,
    210,
    211,
    212
   ]
  },
  {
   "peripheral": "SPI3",
   "bus": "APB1",
   "register": "RCC_APB1ENR",
   "bit": 15,
   "confidence": "high",
   "source_pages": [
    183,
    184,
    185,
    186,
    187,
    210,
    211,
    212
   ]
  },
  {
   "peripheral": "SPI2",
   "bus": "APB1",
   "register": "RCC_APB1ENR",
   "bit": 14,
   "confidence": "high",
   "source_pages": [
    183,
    184,
    185,
    186,
    187,
    210,
    211,
    212
   ]
  },
  {
   "peripheral": "WWDG",
   "bus": "APB1",
   "register": "RCC_APB1ENR",
   "bit": 11,
   "confidence": "high",
   "source_pages": [
    183,
    184,
    185,
    186,
    187,
    210,
    211,
    212
   ]
  },
  {
   "peripheral": "TIM14",
   "bus": "APB1",
   "register": "RCC_APB1ENR",
   "bit": 8,
   "confidence": "high",
   "source_pages": [
    183,
    184,
    185,
    186,
    187,
    210,
    211,
    212
   ]
  },
  {
   "peripheral": "TIM13",
   "bus": "APB1",
   "register": "RCC_APB1ENR",
   "bit": 7,
   "confidence": "high",
   "source_pages": [
    183,
    184,
    185,
    186,
    187,
    210,
    211,
    212
   ]
  },
  {